{
  "contract_version": "metadata.authoring.draft.v1",
  "display_name": "주문·매출 분석",
  "description": "제조 공정과 무관한 범용성 검증을 위한 주문, 상품, 환불, 목표 데이터 도메인입니다.",
  "locale": "ko-KR",
  "timezone": "Asia/Seoul",
  "datasets": {
    "orders": {
      "display_name": "주문",
      "family": "sales_actual",
      "source_type": "dummy",
      "source_adapter": "dummy.orders.v1",
      "time_scope": "history",
      "config_ref": "config:dummy:order_sales@1",
      "query_ref": "query:orders@1",
      "parameters": {
        "DATE_FROM": {"type": "LocalDate", "required": false},
        "DATE_TO": {"type": "LocalDate", "required": false}
      },
      "date_policy": {
        "field": "ORDER_DATE",
        "timezone": "Asia/Seoul",
        "inclusive_start": true,
        "inclusive_end": true
      },
      "fields": {
        "ORDER_ID": {
          "physical_column": "order_id",
          "aliases": ["주문번호", "order id"],
          "semantic_type": "identifier",
          "roles": ["filter", "join", "project", "output"],
          "required_in_source": true,
          "nullable": false
        },
        "ORDER_DATE": {
          "physical_column": "order_date",
          "aliases": ["주문일", "날짜"],
          "semantic_type": "LocalDate",
          "roles": ["filter", "group", "sort", "project", "output"],
          "required_in_source": true,
          "nullable": false,
          "timezone": "Asia/Seoul"
        },
        "CUSTOMER_ID": {
          "physical_column": "customer_id",
          "aliases": ["고객", "고객 ID"],
          "semantic_type": "identifier",
          "roles": ["filter", "group", "join", "project", "output"]
        },
        "PRODUCT_ID": {
          "physical_column": "product_id",
          "aliases": ["상품", "상품 ID"],
          "semantic_type": "identifier",
          "roles": ["filter", "group", "join", "project", "output"],
          "required_in_source": true,
          "nullable": false
        },
        "SALES_AMOUNT": {
          "physical_column": "sales_amount",
          "aliases": ["매출", "주문금액", "판매금액"],
          "semantic_type": "currency",
          "roles": ["filter", "aggregate", "compare", "sort", "rank", "metric", "project", "output"],
          "required_in_source": true,
          "nullable": false,
          "unit": "KRW",
          "allowed_rollups": ["sum", "mean", "min", "max"]
        }
      },
      "default_detail_fields": ["ORDER_ID", "ORDER_DATE", "CUSTOMER_ID", "PRODUCT_ID", "SALES_AMOUNT"],
      "read_policy": {"read_only": true, "timeout_seconds": 30, "max_rows": 50000}
    },
    "products": {
      "display_name": "상품 마스터",
      "family": "product_master",
      "source_type": "dummy",
      "source_adapter": "dummy.products.v1",
      "time_scope": "current",
      "config_ref": "config:dummy:order_sales@1",
      "query_ref": "query:products@1",
      "parameters": {},
      "date_policy": {},
      "fields": {
        "PRODUCT_ID": {
          "physical_column": "product_id",
          "aliases": ["상품", "상품 ID"],
          "semantic_type": "identifier",
          "roles": ["filter", "group", "join", "project", "output"],
          "required_in_source": true,
          "nullable": false
        },
        "PRODUCT_NAME": {
          "physical_column": "product_name",
          "aliases": ["상품명", "제품명"],
          "semantic_type": "string",
          "roles": ["filter", "group", "project", "sort", "output"],
          "required_in_source": true,
          "nullable": false
        },
        "CATEGORY": {
          "physical_column": "category",
          "aliases": ["카테고리", "상품군"],
          "semantic_type": "string",
          "roles": ["filter", "group", "project", "sort", "output"]
        }
      },
      "default_detail_fields": ["PRODUCT_ID", "PRODUCT_NAME", "CATEGORY"],
      "read_policy": {"read_only": true, "timeout_seconds": 30, "max_rows": 10000}
    },
    "refunds": {
      "display_name": "환불",
      "family": "sales_refund",
      "source_type": "dummy",
      "source_adapter": "dummy.refunds.v1",
      "time_scope": "history",
      "config_ref": "config:dummy:order_sales@1",
      "query_ref": "query:refunds@1",
      "parameters": {},
      "date_policy": {},
      "fields": {
        "ORDER_ID": {
          "physical_column": "order_id",
          "aliases": ["주문번호", "order id"],
          "semantic_type": "identifier",
          "roles": ["filter", "join", "project", "output"],
          "required_in_source": true,
          "nullable": false
        },
        "PRODUCT_ID": {
          "physical_column": "product_id",
          "aliases": ["상품", "상품 ID"],
          "semantic_type": "identifier",
          "roles": ["filter", "group", "join", "project", "output"],
          "required_in_source": true,
          "nullable": false
        },
        "REFUND_AMOUNT": {
          "physical_column": "refund_amount",
          "aliases": ["환불액", "환불금액"],
          "semantic_type": "currency",
          "roles": ["filter", "aggregate", "compare", "sort", "rank", "metric", "project", "output"],
          "required_in_source": true,
          "nullable": false,
          "unit": "KRW",
          "allowed_rollups": ["sum", "mean", "min", "max"]
        }
      },
      "default_detail_fields": ["ORDER_ID", "PRODUCT_ID", "REFUND_AMOUNT"],
      "read_policy": {"read_only": true, "timeout_seconds": 30, "max_rows": 50000}
    },
    "targets": {
      "display_name": "상품별 매출 목표",
      "family": "sales_target",
      "source_type": "dummy",
      "source_adapter": "dummy.targets.v1",
      "time_scope": "history",
      "config_ref": "config:dummy:order_sales@1",
      "query_ref": "query:targets@1",
      "parameters": {
        "DATE_FROM": {"type": "LocalDate", "required": false},
        "DATE_TO": {"type": "LocalDate", "required": false}
      },
      "date_policy": {"field": "TARGET_DATE", "timezone": "Asia/Seoul", "inclusive_start": true, "inclusive_end": true},
      "fields": {
        "TARGET_DATE": {
          "physical_column": "target_date",
          "aliases": ["목표일", "기준일", "날짜"],
          "semantic_type": "LocalDate",
          "roles": ["filter", "group", "join", "sort", "project", "output"],
          "timezone": "Asia/Seoul",
          "required_in_source": true,
          "nullable": false
        },
        "PRODUCT_ID": {
          "physical_column": "product_id",
          "aliases": ["상품", "상품 ID"],
          "semantic_type": "identifier",
          "roles": ["filter", "group", "join", "project", "output"],
          "required_in_source": true,
          "nullable": false
        },
        "TARGET_AMOUNT": {
          "physical_column": "target_amount",
          "aliases": ["매출목표", "목표금액", "목표액"],
          "semantic_type": "currency",
          "roles": ["filter", "aggregate", "compare", "sort", "rank", "metric", "project", "output"],
          "required_in_source": true,
          "nullable": false,
          "unit": "KRW",
          "allowed_rollups": ["sum", "min", "max"]
        }
      },
      "default_detail_fields": ["TARGET_DATE", "PRODUCT_ID", "TARGET_AMOUNT"],
      "read_policy": {"read_only": true, "timeout_seconds": 30, "max_rows": 10000}
    }
  },
  "metrics": {
    "SALES_AMOUNT": {
      "aliases": ["매출", "매출액", "주문금액"],
      "source_field": "SALES_AMOUNT",
      "source_binding": {"dataset_family": "sales_actual", "field": "SALES_AMOUNT"},
      "aggregation": "sum",
      "additivity": {"default": "fully_additive", "allowed_rollups": ["sum", "mean", "min", "max"]},
      "unit": "KRW"
    },
    "REFUND_AMOUNT": {
      "aliases": ["환불", "환불액", "환불금액"],
      "source_field": "REFUND_AMOUNT",
      "source_binding": {"dataset_family": "sales_refund", "field": "REFUND_AMOUNT"},
      "aggregation": "sum",
      "additivity": {"default": "fully_additive", "allowed_rollups": ["sum", "mean", "min", "max"]},
      "unit": "KRW"
    },
    "TARGET_AMOUNT": {
      "aliases": ["목표", "매출목표", "목표금액", "목표액"],
      "source_field": "TARGET_AMOUNT",
      "source_binding": {"dataset_family": "sales_target", "field": "TARGET_AMOUNT"},
      "aggregation": "sum",
      "additivity": {"default": "fully_additive", "allowed_rollups": ["sum", "min", "max"]},
      "unit": "KRW"
    },
    "NET_SALES_AMOUNT": {
      "aliases": ["순매출", "순매출액"],
      "aggregation": "sum",
      "additivity": {"default": "fully_additive", "allowed_rollups": ["sum"]},
      "formula": {"op": "subtract", "left_metric": "SALES_AMOUNT", "right_metric": "REFUND_AMOUNT"},
      "unit": "KRW"
    },
    "ACHIEVEMENT_RATE": {
      "aliases": ["달성률", "목표 달성률"],
      "aggregation": "ratio_after_aggregate",
      "additivity": {"default": "non_additive", "allowed_rollups": ["mean"]},
      "formula": {"op": "safe_divide", "numerator_metric": "SALES_AMOUNT", "denominator_metric": "TARGET_AMOUNT"},
      "unit": "percent"
    }
  },
  "entity_groups": {
    "all_products": {
      "aliases": ["전체 상품", "모든 상품"],
      "entity": "PRODUCT_ID",
      "selection": {"operator": "all_registered"}
    },
    "electronics_category": {
      "aliases": ["전자 카테고리", "전자 상품군"],
      "target_field": "CATEGORY",
      "selection": {"operator": "eq", "value": "A", "semantic_type": "string"}
    },
    "living_category": {
      "aliases": ["생활 카테고리", "생활 상품군"],
      "target_field": "CATEGORY",
      "selection": {"operator": "eq", "value": "B", "semantic_type": "string"}
    }
  },
  "grains": {
    "product": {"keys": ["PRODUCT_ID"], "display_fields": ["PRODUCT_NAME", "CATEGORY"]},
    "customer": {"keys": ["CUSTOMER_ID"]},
    "order": {"keys": ["ORDER_ID"]},
    "date_product": {"keys": ["TARGET_DATE", "PRODUCT_ID"]}
  },
  "relations": {
    "orders_products": {
      "left_dataset": "orders",
      "right_dataset": "products",
      "left_keys": ["PRODUCT_ID"],
      "right_keys": ["PRODUCT_ID"],
      "join_type": "left",
      "cardinality": "many_to_one",
      "null_key_policy": "never_match",
      "multi_match_policy": "fail"
    },